<?xml version="1.0" encoding="UTF-8"?>
<xs:schema xmlns:xs="http://www.w3.org/2001/XMLSchema">
    <xs:element name="tabla_periodica">
        <xs:complexType>
            <xs:sequence>
                <xs:element name="estado">
                    <xs:simpleType>
                        <xs:restriction base="xs:string">
                            <xs:enumeration value="solido"/>
                            <xs:enumeration value="liquido"/>
                            <xs:enumeration value="gaseoso"/>
                        </xs:restriction>
                    </xs:simpleType>
                </xs:element>
                <xs:element name="nombre" type="xs:string" />
                <xs:element name="simbolo">
                    <xs:simpleType>
                    <xs:restriction base="xs:string">
                    <xs:pattern value="[A-Z]{1}[a-z]{2}"/>
                    </xs:restriction>
                    </xs:simpleType>
                </xs:element>
                <xs:element name="numero_atomico" type="xs:integer" />
                <xs:element name="peso_atomico" type="xs:decimal" />
                <xs:element name="punto_ebulliciÃ³n" type="xs:decimal" />
                <xs:element name="densidad" type="xs:decimal" />
            </xs:sequence>
        </xs:complexType>
    </xs:element>
</xs:schema>